{
  "office": "assembly/nec-5125b4f7",
  "person_id": "i-yongseon-1958",
  "party_id": "deobureo-minjudang",
  "starts_on": "2024-05-30",
  "ends_on": null,
  "how": "elected",
  "election_id": "20240410",
  "source_urls": [
    "https://open.assembly.go.kr/portal/data/service/selectServicePage.do/OAJPOY0010182J19421",
    "https://www.data.go.kr/data/15000864/openapi.do"
  ],
  "verified": false,
  "checked_at": "2026-10-21"
}
