{
  "office": "local-head/43720",
  "person_id": "choe-jaehyeong-1964",
  "party_id": "gungminui-him",
  "starts_on": "2026-07-01",
  "ends_on": null,
  "how": "elected",
  "election_id": "20260603",
  "source_urls": [
    "https://www.data.go.kr/data/15000864/openapi.do",
    "https://www.law.go.kr/%EB%B2%95%EB%A0%B9/%EA%B3%B5%EC%A7%81%EC%84%A0%EA%B1%B0%EB%B2%95/%EC%A0%9C14%EC%A1%B0"
  ],
  "verified": false,
  "checked_at": "2026-11-01"
}
